
Bus 001 Device 002: ID 0463:ffff MGE UPS Systems UPS
Device Descriptor:
  bLength                18
  bDescriptorType         1
  bcdUSB               1.10
  bDeviceClass            0 (Defined at Interface level)
  bDeviceSubClass         0 
  bDeviceProtocol         0 
  bMaxPacketSize0         8
  idVendor           0x0463 MGE UPS Systems
  idProduct          0xffff UPS
  bcdDevice            0.01
  iManufacturer           1 MGE UPS SYSTEMS
  iProduct                2 Evolution
  iSerial                 0 
  bNumConfigurations      1
  Configuration Descriptor:
    bLength                 9
    bDescriptorType         2
    wTotalLength           34
    bNumInterfaces          1
    bConfigurationValue     1
    iConfiguration          0 
    bmAttributes         0xa0
      Remote Wakeup
    MaxPower               20mA
    Interface Descriptor:
      bLength                 9
      bDescriptorType         4
      bInterfaceNumber        0
      bAlternateSetting       0
      bNumEndpoints           1
      bInterfaceClass         3 Human Interface Devices
      bInterfaceSubClass      0 No Subclass
      bInterfaceProtocol      0 None
      iInterface              0 
        HID Device Descriptor:
          bLength                 9
          bDescriptorType        33
          bcdHID               1.00
          bCountryCode           33 US
          bNumDescriptors         1
          bDescriptorType        34 Report
          wDescriptorLength    1300
          Report Descriptor: (length is 1300)
            Item(Global): Usage Page, data= [ 0x84 ] 132
                            Power Device Page
            Item(Local ): Usage, data= [ 0x04 ] 4
                            UPS
            Item(Main  ): Collection, data= [ 0x00 ] 0
                            Physical
            Item(Local ): Usage, data= [ 0x24 ] 36
                            Power Summary
            Item(Main  ): Collection, data= [ 0x00 ] 0
                            Physical
            Item(Local ): Usage, data= [ 0x25 ] 37
                            Power Summary ID
            Item(Global): Report Count, data= [ 0x01 ] 1
            Item(Global): Report ID, data= [ 0x26 ] 38
            Item(Global): Report Size, data= [ 0x08 ] 8
            Item(Global): Logical Minimum, data= [ 0x00 ] 0
            Item(Global): Logical Maximum, data= [ 0xff 0x00 ] 255
            Item(Global): Unit, data= [ 0x00 ] 0
            Item(Global): Unit Exponent, data= [ 0x00 ] 0
            Item(Main  ): Feature, data= [ 0x03 ] 3
                            Constant Variable Absolute No_Wrap Linear
                            Preferred_State No_Null_Position Non_Volatile Bitfield
            Item(Local ): Usage, data= [ 0x1f ] 31
                            Flow ID
            Item(Main  ): Feature, data= [ 0x03 ] 3
                            Constant Variable Absolute No_Wrap Linear
                            Preferred_State No_Null_Position Non_Volatile Bitfield
            Item(Local ): Usage, data= [ 0x5a ] 90
                            Audible Alarm Control
            Item(Global): Report ID, data= [ 0x0a ] 10
            Item(Main  ): Feature, data= [ 0x82 ] 130
                            Data Variable Absolute No_Wrap Linear
                            Preferred_State No_Null_Position Volatile Bitfield
            Item(Local ): Usage, data= [ 0x5a ] 90
                            Audible Alarm Control
            Item(Main  ): Input, data= [ 0x82 ] 130
                            Data Variable Absolute No_Wrap Linear
                            Preferred_State No_Null_Position Volatile Bitfield
            Item(Global): Usage Page, data= [ 0x85 ] 133
                            Battery System Page
            Item(Local ): Usage, data= [ 0x8d ] 141
                            Capacity Granularity 1
            Item(Global): Report ID, data= [ 0x26 ] 38
            Item(Main  ): Feature, data= [ 0x03 ] 3
                            Constant Variable Absolute No_Wrap Linear
                            Preferred_State No_Null_Position Non_Volatile Bitfield
            Item(Local ): Usage, data= [ 0x2c ] 44
                            Capacity Mode
            Item(Main  ): Feature, data= [ 0x03 ] 3
                            Constant Variable Absolute No_Wrap Linear
                            Preferred_State No_Null_Position Non_Volatile Bitfield
            Item(Global): Usage Page, data= [ 0x84 ] 132
                            Power Device Page
            Item(Local ): Usage, data= [ 0x40 ] 64
                            Config Voltage
            Item(Global): Report Size, data= [ 0x10 ] 16
            Item(Global): Report ID, data= [ 0x27 ] 39
            Item(Global): Unit, data= [ 0x21 0xd1 0xf0 0x00 ] 15782177
            Item(Global): Unit Exponent, data= [ 0x07 ] 7
            Item(Global): Logical Maximum, data= [ 0xff 0x7f ] 32767
            Item(Main  ): Feature, data= [ 0x83 ] 131
                            Constant Variable Absolute No_Wrap Linear
                            Preferred_State No_Null_Position Volatile Bitfield
            Item(Local ): Usage, data= [ 0x57 ] 87
                            Delay Before Shutdown
            Item(Global): Report Size, data= [ 0x18 ] 24
            Item(Global): Report ID, data= [ 0x28 ] 40
            Item(Global): Unit, data= [ 0x01 0x10 ] 4097
            Item(Global): Unit Exponent, data= [ 0x00 ] 0
            Item(Global): Logical Minimum, data= [ 0xff ] 255
            Item(Global): Logical Maximum, data= [ 0xff 0xff 0x00 0x00 ] 65535
            Item(Main  ): Feature, data= [ 0x82 ] 130
                            Data Variable Absolute No_Wrap Linear
                            Preferred_State No_Null_Position Volatile Bitfield
            Item(Local ): Usage, data= [ 0x56 ] 86
                            Delay Before Startup
            Item(Global): Report ID, data= [ 0x29 ] 41
            Item(Global): Unit Exponent, data= [ 0x01 ] 1
            Item(Main  ): Feature, data= [ 0x82 ] 130
                            Data Variable Absolute No_Wrap Linear
                            Preferred_State No_Null_Position Volatile Bitfield
            Item(Global): Usage Page, data= [ 0x85 ] 133
                            Battery System Page
            Item(Local ): Usage, data= [ 0x83 ] 131
                            Design Capacity
            Item(Global): Report Size, data= [ 0x08 ] 8
            Item(Global): Report ID, data= [ 0x26 ] 38
            Item(Global): Unit, data= [ 0x00 ] 0
            Item(Global): Unit Exponent, data= [ 0x00 ] 0
            Item(Global): Logical Minimum, data= [ 0x00 ] 0
            Item(Global): Logical Maximum, data= [ 0xff 0x00 ] 255
            Item(Main  ): Feature, data= [ 0x83 ] 131
                            Constant Variable Absolute No_Wrap Linear
                            Preferred_State No_Null_Position Volatile Bitfield
            Item(Local ): Usage, data= [ 0x89 ] 137
                            iDeviceChemistry
            Item(Global): Report ID, data= [ 0x2a ] 42
            Item(Main  ): Feature, data= [ 0x83 ] 131
                            Constant Variable Absolute No_Wrap Linear
                            Preferred_State No_Null_Position Volatile Bitfield
            Item(Local ): Usage, data= [ 0x8f ] 143
                            iOEMInformation
            Item(Main  ): Feature, data= [ 0x83 ] 131
                            Constant Variable Absolute No_Wrap Linear
                            Preferred_State No_Null_Position Volatile Bitfield
            Item(Local ): Usage, data= [ 0x8b ] 139
                            Rechargeable
            Item(Global): Report ID, data= [ 0x26 ] 38
            Item(Main  ): Feature, data= [ 0x83 ] 131
                            Constant Variable Absolute No_Wrap Linear
                            Preferred_State No_Null_Position Volatile Bitfield
            Item(Local ): Usage, data= [ 0x66 ] 102
                            Remaining Capacity
            Item(Global): Report ID, data= [ 0x09 ] 9
            Item(Main  ): Feature, data= [ 0x83 ] 131
                            Constant Variable Absolute No_Wrap Linear
                            Preferred_State No_Null_Position Volatile Bitfield
            Item(Local ): Usage, data= [ 0x66 ] 102
                            Remaining Capacity
            Item(Main  ): Input, data= [ 0x83 ] 131
                            Constant Variable Absolute No_Wrap Linear
                            Preferred_State No_Null_Position Volatile Bitfield
            Item(Local ): Usage, data= [ 0x29 ] 41
                            Remaining Capacity Limit
            Item(Global): Report ID, data= [ 0x2b ] 43
            Item(Main  ): Feature, data= [ 0x03 ] 3
                            Constant Variable Absolute No_Wrap Linear
                            Preferred_State No_Null_Position Non_Volatile Bitfield
            Item(Local ): Usage, data= [ 0x68 ] 104
                            Run Time To Empty
            Item(Global): Report Size, data= [ 0x10 ] 16
            Item(Global): Report ID, data= [ 0x09 ] 9
            Item(Global): Unit, data= [ 0x01 0x10 ] 4097
            Item(Global): Logical Maximum, data= [ 0xff 0xff 0x00 0x00 ] 65535
            Item(Main  ): Feature, data= [ 0x83 ] 131
                            Constant Variable Absolute No_Wrap Linear
                            Preferred_State No_Null_Position Volatile Bitfield
            Item(Local ): Usage, data= [ 0x68 ] 104
                            Run Time To Empty
            Item(Main  ): Input, data= [ 0x83 ] 131
                            Constant Variable Absolute No_Wrap Linear
                            Preferred_State No_Null_Position Volatile Bitfield
            Item(Global): Usage Page, data= [ 0xff 0xff ] 65535
                            (null)
            Item(Local ): Usage, data= [ 0x4d ] 77
                            (null)
            Item(Global): Report Size, data= [ 0x08 ] 8
            Item(Global): Unit, data= [ 0x00 ] 0
            Item(Global): Logical Maximum, data= [ 0xff 0x00 ] 255
            Item(Global): Report ID, data= [ 0x2c ] 44
            Item(Main  ): Feature, data= [ 0x82 ] 130
                            Data Variable Absolute No_Wrap Linear
                            Preferred_State No_Null_Position Volatile Bitfield
            Item(Local ): Usage, data= [ 0x5f ] 95
                            (null)
            Item(Global): Report ID, data= [ 0x2d ] 45
            Item(Main  ): Feature, data= [ 0x82 ] 130
                            Data Variable Absolute No_Wrap Linear
                            Preferred_State No_Null_Position Volatile Bitfield
            Item(Local ): Usage, data= [ 0x48 ] 72
                            (null)
            Item(Global): Report ID, data= [ 0x2e ] 46
            Item(Main  ): Feature, data= [ 0x82 ] 130
                            Data Variable Absolute No_Wrap Linear
                            Preferred_State No_Null_Position Volatile Bitfield
            Item(Local ): Usage, data= [ 0xf0 ] 240
                            (null)
            Item(Global): Report ID, data= [ 0x2a ] 42
            Item(Main  ): Feature, data= [ 0x83 ] 131
                            Constant Variable Absolute No_Wrap Linear
                            Preferred_State No_Null_Position Volatile Bitfield
            Item(Global): Usage Page, data= [ 0x84 ] 132
                            Power Device Page
            Item(Local ): Usage, data= [ 0xfd ] 253
                            iManufacturer
            Item(Main  ): Feature, data= [ 0x83 ] 131
                            Constant Variable Absolute No_Wrap Linear
                            Preferred_State No_Null_Position Volatile Bitfield
            Item(Local ): Usage, data= [ 0xfe ] 254
                            iProduct
            Item(Main  ): Feature, data= [ 0x83 ] 131
                            Constant Variable Absolute No_Wrap Linear
                            Preferred_State No_Null_Position Volatile Bitfield
            Item(Local ): Usage, data= [ 0xff ] 255
                            iSerialNumber
            Item(Main  ): Feature, data= [ 0x83 ] 131
                            Constant Variable Absolute No_Wrap Linear
                            Preferred_State No_Null_Position Volatile Bitfield
            Item(Local ): Usage, data= [ 0x35 ] 53
                            Percent Load
            Item(Global): Report ID, data= [ 0x2b ] 43
            Item(Main  ): Feature, data= [ 0x83 ] 131
                            Constant Variable Absolute No_Wrap Linear
                            Preferred_State No_Null_Position Volatile Bitfield
            Item(Local ): Usage, data= [ 0x30 ] 48
                            Voltage
            Item(Global): Report Size, data= [ 0x10 ] 16
            Item(Global): Unit, data= [ 0x21 0xd1 0xf0 0x00 ] 15782177
            Item(Global): Unit Exponent, data= [ 0x07 ] 7
            Item(Global): Logical Maximum, data= [ 0xff 0x7f ] 32767
            Item(Main  ): Feature, data= [ 0x83 ] 131
                            Constant Variable Absolute No_Wrap Linear
                            Preferred_State No_Null_Position Volatile Bitfield
            Item(Local ): Usage, data= [ 0x02 ] 2
                            Present Status
            Item(Main  ): Collection, data= [ 0x00 ] 0
                            Physical
            Item(Local ): Usage, data= [ 0x61 ] 97
                            Good
            Item(Global): Report Size, data= [ 0x08 ] 8
            Item(Global): Unit, data= [ 0x00 ] 0
            Item(Global): Unit Exponent, data= [ 0x00 ] 0
            Item(Global): Logical Maximum, data= [ 0x01 ] 1
            Item(Global): Report ID, data= [ 0x06 ] 6
            Item(Main  ): Feature, data= [ 0x83 ] 131
                            Constant Variable Absolute No_Wrap Linear
                            Preferred_State No_Null_Position Volatile Bitfield
            Item(Local ): Usage, data= [ 0x61 ] 97
                            Good
            Item(Main  ): Input, data= [ 0x83 ] 131
                            Constant Variable Absolute No_Wrap Linear
                            Preferred_State No_Null_Position Volatile Bitfield
            Item(Local ): Usage, data= [ 0x62 ] 98
                            Internal Failure
            Item(Main  ): Feature, data= [ 0x83 ] 131
                            Constant Variable Absolute No_Wrap Linear
                            Preferred_State No_Null_Position Volatile Bitfield
            Item(Local ): Usage, data= [ 0x62 ] 98
                            Internal Failure
            Item(Main  ): Input, data= [ 0x83 ] 131
                            Constant Variable Absolute No_Wrap Linear
                            Preferred_State No_Null_Position Volatile Bitfield
            Item(Local ): Usage, data= [ 0x65 ] 101
                            Overload
            Item(Main  ): Feature, data= [ 0x83 ] 131
                            Constant Variable Absolute No_Wrap Linear
                            Preferred_State No_Null_Position Volatile Bitfield
            Item(Local ): Usage, data= [ 0x65 ] 101
                            Overload
            Item(Main  ): Input, data= [ 0x83 ] 131
                            Constant Variable Absolute No_Wrap Linear
                            Preferred_State No_Null_Position Volatile Bitfield
            Item(Local ): Usage, data= [ 0x67 ] 103
                            Over Temperature
            Item(Global): Report ID, data= [ 0x0b ] 11
            Item(Main  ): Feature, data= [ 0x83 ] 131
                            Constant Variable Absolute No_Wrap Linear
                            Preferred_State No_Null_Position Volatile Bitfield
            Item(Local ): Usage, data= [ 0x67 ] 103
                            Over Temperature
            Item(Main  ): Input, data= [ 0x83 ] 131
                            Constant Variable Absolute No_Wrap Linear
                            Preferred_State No_Null_Position Volatile Bitfield
            Item(Local ): Usage, data= [ 0x73 ] 115
                            Communication Lost
            Item(Main  ): Feature, data= [ 0x83 ] 131
                            Constant Variable Absolute No_Wrap Linear
                            Preferred_State No_Null_Position Volatile Bitfield
            Item(Local ): Usage, data= [ 0x73 ] 115
                            Communication Lost
            Item(Main  ): Input, data= [ 0x83 ] 131
                            Constant Variable Absolute No_Wrap Linear
                            Preferred_State No_Null_Position Volatile Bitfield
            Item(Local ): Usage, data= [ 0x69 ] 105
                            Shutdown  Imminent
            Item(Global): Report ID, data= [ 0x06 ] 6
            Item(Main  ): Feature, data= [ 0x83 ] 131
                            Constant Variable Absolute No_Wrap Linear
                            Preferred_State No_Null_Position Volatile Bitfield
            Item(Local ): Usage, data= [ 0x69 ] 105
                            Shutdown  Imminent
            Item(Main  ): Input, data= [ 0x83 ] 131
                            Constant Variable Absolute No_Wrap Linear
                            Preferred_State No_Null_Position Volatile Bitfield
            Item(Global): Usage Page, data= [ 0x85 ] 133
                            Battery System Page
            Item(Local ): Usage, data= [ 0xd0 ] 208
                            AC Present
            Item(Main  ): Feature, data= [ 0x83 ] 131
                            Constant Variable Absolute No_Wrap Linear
                            Preferred_State No_Null_Position Volatile Bitfield
            Item(Local ): Usage, data= [ 0xd0 ] 208
                            AC Present
            Item(Main  ): Input, data= [ 0x83 ] 131
                            Constant Variable Absolute No_Wrap Linear
                            Preferred_State No_Null_Position Volatile Bitfield
            Item(Local ): Usage, data= [ 0x42 ] 66
                            Below Remaining Capacity Limit
            Item(Main  ): Feature, data= [ 0x83 ] 131
                            Constant Variable Absolute No_Wrap Linear
                            Preferred_State No_Null_Position Volatile Bitfield
            Item(Local ): Usage, data= [ 0x42 ] 66
                            Below Remaining Capacity Limit
            Item(Main  ): Input, data= [ 0x83 ] 131
                            Constant Variable Absolute No_Wrap Linear
                            Preferred_State No_Null_Position Volatile Bitfield
            Item(Local ): Usage, data= [ 0x44 ] 68
                            Charging
            Item(Global): Report ID, data= [ 0x0b ] 11
            Item(Main  ): Feature, data= [ 0x83 ] 131
                            Constant Variable Absolute No_Wrap Linear
                            Preferred_State No_Null_Position Volatile Bitfield
            Item(Local ): Usage, data= [ 0x44 ] 68
                            Charging
            Item(Main  ): Input, data= [ 0x83 ] 131
                            Constant Variable Absolute No_Wrap Linear
                            Preferred_State No_Null_Position Volatile Bitfield
            Item(Local ): Usage, data= [ 0x45 ] 69
                            Discharging
            Item(Main  ): Feature, data= [ 0x83 ] 131
                            Constant Variable Absolute No_Wrap Linear
                            Preferred_State No_Null_Position Volatile Bitfield
            Item(Local ): Usage, data= [ 0x45 ] 69
                            Discharging
            Item(Main  ): Input, data= [ 0x83 ] 131
                            Constant Variable Absolute No_Wrap Linear
                            Preferred_State No_Null_Position Volatile Bitfield
            Item(Local ): Usage, data= [ 0x4b ] 75
                            Need Replacement
            Item(Global): Report ID, data= [ 0x0b ] 11
            Item(Main  ): Feature, data= [ 0x83 ] 131
                            Constant Variable Absolute No_Wrap Linear
                            Preferred_State No_Null_Position Volatile Bitfield
            Item(Local ): Usage, data= [ 0x4b ] 75
                            Need Replacement
            Item(Main  ): Input, data= [ 0x83 ] 131
                            Constant Variable Absolute No_Wrap Linear
                            Preferred_State No_Null_Position Volatile Bitfield
            Item(Global): Usage Page, data= [ 0x84 ] 132
                            Power Device Page
            Item(Local ): Usage, data= [ 0x6c ] 108
                            Switchable
            Item(Global): Report ID, data= [ 0x3a ] 58
            Item(Main  ): Feature, data= [ 0x82 ] 130
                            Data Variable Absolute No_Wrap Linear
                            Preferred_State No_Null_Position Volatile Bitfield
            Item(Main  ): End Collection, data=none
            Item(Main  ): End Collection, data=none
            Item(Local ): Usage, data= [ 0x10 ] 16
                            Battery System
            Item(Main  ): Collection, data= [ 0x00 ] 0
                            Physical
            Item(Local ): Usage, data= [ 0x11 ] 17
                            Battery System ID
            Item(Global): Report ID, data= [ 0x11 ] 17
            Item(Global): Logical Maximum, data= [ 0xff 0x00 ] 255
            Item(Main  ): Feature, data= [ 0x03 ] 3
                            Constant Variable Absolute No_Wrap Linear
                            Preferred_State No_Null_Position Non_Volatile Bitfield
            Item(Local ): Usage, data= [ 0x12 ] 18
                            Battery
            Item(Main  ): Collection, data= [ 0x00 ] 0
                            Physical
            Item(Local ): Usage, data= [ 0x13 ] 19
                            Battery ID
            Item(Main  ): Feature, data= [ 0x03 ] 3
                            Constant Variable Absolute No_Wrap Linear
                            Preferred_State No_Null_Position Non_Volatile Bitfield
            Item(Global): Usage Page, data= [ 0x85 ] 133
                            Battery System Page
            Item(Local ): Usage, data= [ 0x6a ] 106
                            Average Time To Full
            Item(Global): Report Size, data= [ 0x10 ] 16
            Item(Global): Logical Maximum, data= [ 0xff 0xff 0x00 0x00 ] 65535
            Item(Global): Unit, data= [ 0x01 0x10 ] 4097
            Item(Main  ): Feature, data= [ 0x83 ] 131
                            Constant Variable Absolute No_Wrap Linear
                            Preferred_State No_Null_Position Volatile Bitfield
            Item(Global): Usage Page, data= [ 0xff 0xff ] 65535
                            (null)
            Item(Local ): Usage, data= [ 0x90 ] 144
                            (null)
            Item(Global): Report Size, data= [ 0x08 ] 8
            Item(Global): Logical Maximum, data= [ 0xff 0x00 ] 255
            Item(Global): Unit, data= [ 0x00 ] 0
            Item(Main  ): Feature, data= [ 0x83 ] 131
                            Constant Variable Absolute No_Wrap Linear
                            Preferred_State No_Null_Position Volatile Bitfield
            Item(Local ): Usage, data= [ 0x49 ] 73
                            (null)
            Item(Global): Logical Maximum, data= [ 0x01 ] 1
            Item(Global): Report ID, data= [ 0x3c ] 60
            Item(Main  ): Feature, data= [ 0x82 ] 130
                            Data Variable Absolute No_Wrap Linear
                            Preferred_State No_Null_Position Volatile Bitfield
            Item(Global): Usage Page, data= [ 0x84 ] 132
                            Power Device Page
            Item(Local ): Usage, data= [ 0x58 ] 88
                            Test
            Item(Global): Logical Maximum, data= [ 0xff 0x00 ] 255
            Item(Global): Report ID, data= [ 0x12 ] 18
            Item(Main  ): Feature, data= [ 0x82 ] 130
                            Data Variable Absolute No_Wrap Linear
                            Preferred_State No_Null_Position Volatile Bitfield
            Item(Global): Usage Page, data= [ 0xff 0xff ] 65535
                            (null)
            Item(Local ): Usage, data= [ 0x45 ] 69
                            (null)
            Item(Global): Report Size, data= [ 0x10 ] 16
            Item(Global): Report ID, data= [ 0x3d ] 61
            Item(Global): Logical Maximum, data= [ 0xff 0xff 0x00 0x00 ] 65535
            Item(Global): Unit, data= [ 0x01 0x10 ] 4097
            Item(Global): Unit Exponent, data= [ 0x02 ] 2
            Item(Main  ): Feature, data= [ 0x82 ] 130
                            Data Variable Absolute No_Wrap Linear
                            Preferred_State No_Null_Position Volatile Bitfield
            Item(Global): Usage Page, data= [ 0x84 ] 132
                            Power Device Page
            Item(Local ): Usage, data= [ 0x02 ] 2
                            Present Status
            Item(Main  ): Collection, data= [ 0x00 ] 0
                            Physical
            Item(Local ): Usage, data= [ 0x61 ] 97
                            Good
            Item(Global): Report Size, data= [ 0x08 ] 8
            Item(Global): Report ID, data= [ 0x01 ] 1
            Item(Global): Unit, data= [ 0x00 ] 0
            Item(Global): Unit Exponent, data= [ 0x00 ] 0
            Item(Global): Logical Maximum, data= [ 0x01 ] 1
            Item(Main  ): Feature, data= [ 0x83 ] 131
                            Constant Variable Absolute No_Wrap Linear
                            Preferred_State No_Null_Position Volatile Bitfield
            Item(Local ): Usage, data= [ 0x61 ] 97
                            Good
            Item(Main  ): Input, data= [ 0x83 ] 131
                            Constant Variable Absolute No_Wrap Linear
                            Preferred_State No_Null_Position Volatile Bitfield
            Item(Local ): Usage, data= [ 0x60 ] 96
                            Present
            Item(Main  ): Feature, data= [ 0x83 ] 131
                            Constant Variable Absolute No_Wrap Linear
                            Preferred_State No_Null_Position Volatile Bitfield
            Item(Local ): Usage, data= [ 0x60 ] 96
                            Present
            Item(Main  ): Input, data= [ 0x83 ] 131
                            Constant Variable Absolute No_Wrap Linear
                            Preferred_State No_Null_Position Volatile Bitfield
            Item(Main  ): End Collection, data=none
            Item(Main  ): End Collection, data=none
            Item(Local ): Usage, data= [ 0x14 ] 20
                            Charger
            Item(Main  ): Collection, data= [ 0x00 ] 0
                            Physical
            Item(Local ): Usage, data= [ 0x15 ] 21
                            Charger ID
            Item(Global): Report ID, data= [ 0x11 ] 17
            Item(Global): Logical Maximum, data= [ 0xff 0x00 ] 255
            Item(Main  ): Feature, data= [ 0x03 ] 3
                            Constant Variable Absolute No_Wrap Linear
                            Preferred_State No_Null_Position Non_Volatile Bitfield
            Item(Local ): Usage, data= [ 0x02 ] 2
                            Present Status
            Item(Main  ): Collection, data= [ 0x00 ] 0
                            Physical
            Item(Local ): Usage, data= [ 0x61 ] 97
                            Good
            Item(Global): Report ID, data= [ 0x01 ] 1
            Item(Global): Logical Maximum, data= [ 0x01 ] 1
            Item(Main  ): Feature, data= [ 0x83 ] 131
                            Constant Variable Absolute No_Wrap Linear
                            Preferred_State No_Null_Position Volatile Bitfield
            Item(Local ): Usage, data= [ 0x61 ] 97
                            Good
            Item(Main  ): Input, data= [ 0x83 ] 131
                            Constant Variable Absolute No_Wrap Linear
                            Preferred_State No_Null_Position Volatile Bitfield
            Item(Local ): Usage, data= [ 0x62 ] 98
                            Internal Failure
            Item(Main  ): Feature, data= [ 0x83 ] 131
                            Constant Variable Absolute No_Wrap Linear
                            Preferred_State No_Null_Position Volatile Bitfield
            Item(Local ): Usage, data= [ 0x62 ] 98
                            Internal Failure
            Item(Main  ): Input, data= [ 0x83 ] 131
                            Constant Variable Absolute No_Wrap Linear
                            Preferred_State No_Null_Position Volatile Bitfield
            Item(Main  ): End Collection, data=none
            Item(Main  ): End Collection, data=none
            Item(Local ): Usage, data= [ 0x1a ] 26
                            Input
            Item(Main  ): Collection, data= [ 0x00 ] 0
                            Physical
            Item(Local ): Usage, data= [ 0x1b ] 27
                            Input ID
            Item(Global): Report ID, data= [ 0x11 ] 17
            Item(Global): Logical Maximum, data= [ 0xff 0x00 ] 255
            Item(Main  ): Feature, data= [ 0x03 ] 3
                            Constant Variable Absolute No_Wrap Linear
                            Preferred_State No_Null_Position Non_Volatile Bitfield
            Item(Local ): Usage, data= [ 0x1f ] 31
                            Flow ID
            Item(Main  ): Feature, data= [ 0x03 ] 3
                            Constant Variable Absolute No_Wrap Linear
                            Preferred_State No_Null_Position Non_Volatile Bitfield
            Item(Main  ): End Collection, data=none
            Item(Local ): Usage, data= [ 0x1c ] 28
                            Output
            Item(Main  ): Collection, data= [ 0x00 ] 0
                            Physical
            Item(Local ): Usage, data= [ 0x1d ] 29
                            Output ID
            Item(Main  ): Feature, data= [ 0x03 ] 3
                            Constant Variable Absolute No_Wrap Linear
                            Preferred_State No_Null_Position Non_Volatile Bitfield
            Item(Local ): Usage, data= [ 0x1f ] 31
                            Flow ID
            Item(Main  ): Feature, data= [ 0x03 ] 3
                            Constant Variable Absolute No_Wrap Linear
                            Preferred_State No_Null_Position Non_Volatile Bitfield
            Item(Main  ): End Collection, data=none
            Item(Main  ): End Collection, data=none
            Item(Local ): Usage, data= [ 0x1e ] 30
                            Flow
            Item(Main  ): Collection, data= [ 0x81 ] 129
                            Vendor defined
            Item(Local ): Usage, data= [ 0x1f ] 31
                            Flow ID
            Item(Global): Report ID, data= [ 0x13 ] 19
            Item(Main  ): Feature, data= [ 0x03 ] 3
                            Constant Variable Absolute No_Wrap Linear
                            Preferred_State No_Null_Position Non_Volatile Bitfield
            Item(Local ): Usage, data= [ 0x42 ] 66
                            Config Frequency
            Item(Global): Unit, data= [ 0x01 0xf0 ] 61441
            Item(Main  ): Feature, data= [ 0x83 ] 131
                            Constant Variable Absolute No_Wrap Linear
                            Preferred_State No_Null_Position Volatile Bitfield
            Item(Local ): Usage, data= [ 0x40 ] 64
                            Config Voltage
            Item(Global): Report Size, data= [ 0x10 ] 16
            Item(Global): Logical Maximum, data= [ 0xff 0xff 0x00 0x00 ] 65535
            Item(Global): Unit, data= [ 0x21 0xd1 0xf0 0x00 ] 15782177
            Item(Global): Unit Exponent, data= [ 0x07 ] 7
            Item(Main  ): Feature, data= [ 0x83 ] 131
                            Constant Variable Absolute No_Wrap Linear
                            Preferred_State No_Null_Position Volatile Bitfield
            Item(Main  ): End Collection, data=none
            Item(Local ): Usage, data= [ 0x1e ] 30
                            Flow
            Item(Main  ): Collection, data= [ 0x83 ] 131
                            Vendor defined
            Item(Local ): Usage, data= [ 0x1f ] 31
                            Flow ID
            Item(Global): Report ID, data= [ 0x13 ] 19
            Item(Global): Report Size, data= [ 0x08 ] 8
            Item(Global): Logical Maximum, data= [ 0xff 0x00 ] 255
            Item(Global): Unit, data= [ 0x00 ] 0
            Item(Global): Unit Exponent, data= [ 0x00 ] 0
            Item(Main  ): Feature, data= [ 0x03 ] 3
                            Constant Variable Absolute No_Wrap Linear
                            Preferred_State No_Null_Position Non_Volatile Bitfield
            Item(Main  ): End Collection, data=none
            Item(Local ): Usage, data= [ 0x1e ] 30
                            Flow
            Item(Main  ): Collection, data= [ 0x84 ] 132
                            Vendor defined
            Item(Local ): Usage, data= [ 0x1f ] 31
                            Flow ID
            Item(Global): Report ID, data= [ 0x14 ] 20
            Item(Main  ): Feature, data= [ 0x03 ] 3
                            Constant Variable Absolute No_Wrap Linear
                            Preferred_State No_Null_Position Non_Volatile Bitfield
            Item(Local ): Usage, data= [ 0x42 ] 66
                            Config Frequency
            Item(Global): Unit, data= [ 0x01 0xf0 ] 61441
            Item(Global): Unit Exponent, data= [ 0x00 ] 0
            Item(Main  ): Feature, data= [ 0x83 ] 131
                            Constant Variable Absolute No_Wrap Linear
                            Preferred_State No_Null_Position Volatile Bitfield
            Item(Local ): Usage, data= [ 0x44 ] 68
                            Config Active Power
            Item(Global): Report Size, data= [ 0x10 ] 16
            Item(Global): Logical Maximum, data= [ 0xff 0xff 0x00 0x00 ] 65535
            Item(Global): Unit, data= [ 0x21 0xd1 ] 53537
            Item(Global): Unit Exponent, data= [ 0x07 ] 7
            Item(Main  ): Feature, data= [ 0x83 ] 131
                            Constant Variable Absolute No_Wrap Linear
                            Preferred_State No_Null_Position Volatile Bitfield
            Item(Local ): Usage, data= [ 0x43 ] 67
                            Config Apparent Power
            Item(Main  ): Feature, data= [ 0x83 ] 131
                            Constant Variable Absolute No_Wrap Linear
                            Preferred_State No_Null_Position Volatile Bitfield
            Item(Local ): Usage, data= [ 0x41 ] 65
                            Config Current
            Item(Global): Unit, data= [ 0x01 0x00 0x10 0x00 ] 1048577
            Item(Global): Unit Exponent, data= [ 0x0e ] 14
            Item(Main  ): Feature, data= [ 0x83 ] 131
                            Constant Variable Absolute No_Wrap Linear
                            Preferred_State No_Null_Position Volatile Bitfield
            Item(Local ): Usage, data= [ 0x40 ] 64
                            Config Voltage
            Item(Global): Report ID, data= [ 0x15 ] 21
            Item(Global): Unit, data= [ 0x21 0xd1 0xf0 0x00 ] 15782177
            Item(Global): Unit Exponent, data= [ 0x07 ] 7
            Item(Main  ): Feature, data= [ 0x82 ] 130
                            Data Variable Absolute No_Wrap Linear
                            Preferred_State No_Null_Position Volatile Bitfield
            Item(Main  ): End Collection, data=none
            Item(Local ): Usage, data= [ 0x16 ] 22
                            Power Converter
            Item(Main  ): Collection, data= [ 0x00 ] 0
                            Physical
            Item(Local ): Usage, data= [ 0x17 ] 23
                            Power Converter ID
            Item(Global): Report ID, data= [ 0x17 ] 23
            Item(Global): Report Size, data= [ 0x08 ] 8
            Item(Global): Logical Maximum, data= [ 0xff 0x00 ] 255
            Item(Global): Unit, data= [ 0x00 ] 0
            Item(Global): Unit Exponent, data= [ 0x00 ] 0
            Item(Main  ): Feature, data= [ 0x03 ] 3
                            Constant Variable Absolute No_Wrap Linear
                            Preferred_State No_Null_Position Non_Volatile Bitfield
            Item(Global): Usage Page, data= [ 0xff 0xff ] 65535
                            (null)
            Item(Local ): Usage, data= [ 0x41 ] 65
                            (null)
            Item(Main  ): Feature, data= [ 0x03 ] 3
                            Constant Variable Absolute No_Wrap Linear
                            Preferred_State No_Null_Position Non_Volatile Bitfield
            Item(Global): Usage Page, data= [ 0x84 ] 132
                            Power Device Page
            Item(Local ): Usage, data= [ 0x1a ] 26
                            Input
            Item(Main  ): Collection, data= [ 0x81 ] 129
                            Vendor defined
            Item(Local ): Usage, data= [ 0x1b ] 27
                            Input ID
            Item(Global): Report ID, data= [ 0x19 ] 25
            Item(Main  ): Feature, data= [ 0x03 ] 3
                            Constant Variable Absolute No_Wrap Linear
                            Preferred_State No_Null_Position Non_Volatile Bitfield
            Item(Local ): Usage, data= [ 0x1f ] 31
                            Flow ID
            Item(Main  ): Feature, data= [ 0x03 ] 3
                            Constant Variable Absolute No_Wrap Linear
                            Preferred_State No_Null_Position Non_Volatile Bitfield
            Item(Local ): Usage, data= [ 0x32 ] 50
                            Frequency
            Item(Global): Unit, data= [ 0x01 0xf0 ] 61441
            Item(Main  ): Feature, data= [ 0x83 ] 131
                            Constant Variable Absolute No_Wrap Linear
                            Preferred_State No_Null_Position Volatile Bitfield
            Item(Local ): Usage, data= [ 0x30 ] 48
                            Voltage
            Item(Global): Report Size, data= [ 0x10 ] 16
            Item(Global): Logical Maximum, data= [ 0xff 0xff 0x00 0x00 ] 65535
            Item(Global): Unit, data= [ 0x21 0xd1 0xf0 0x00 ] 15782177
            Item(Global): Unit Exponent, data= [ 0x07 ] 7
            Item(Main  ): Feature, data= [ 0x83 ] 131
                            Constant Variable Absolute No_Wrap Linear
                            Preferred_State No_Null_Position Volatile Bitfield
            Item(Global): Usage Page, data= [ 0xff 0xff ] 65535
                            (null)
            Item(Local ): Usage, data= [ 0x43 ] 67
                            (null)
            Item(Global): Report ID, data= [ 0x18 ] 24
            Item(Global): Report Size, data= [ 0x08 ] 8
            Item(Global): Logical Maximum, data= [ 0x01 ] 1
            Item(Global): Unit, data= [ 0x00 ] 0
            Item(Global): Unit Exponent, data= [ 0x00 ] 0
            Item(Main  ): Feature, data= [ 0x82 ] 130
                            Data Variable Absolute No_Wrap Linear
                            Preferred_State No_Null_Position Volatile Bitfield
            Item(Global): Usage Page, data= [ 0x84 ] 132
                            Power Device Page
            Item(Local ): Usage, data= [ 0x02 ] 2
                            Present Status
            Item(Main  ): Collection, data= [ 0x00 ] 0
                            Physical
            Item(Local ): Usage, data= [ 0x6e ] 110
                            Boost
            Item(Global): Report ID, data= [ 0x03 ] 3
            Item(Main  ): Feature, data= [ 0x83 ] 131
                            Constant Variable Absolute No_Wrap Linear
                            Preferred_State No_Null_Position Volatile Bitfield
            Item(Local ): Usage, data= [ 0x6e ] 110
                            Boost
            Item(Main  ): Input, data= [ 0x83 ] 131
                            Constant Variable Absolute No_Wrap Linear
                            Preferred_State No_Null_Position Volatile Bitfield
            Item(Local ): Usage, data= [ 0x6f ] 111
                            Buck
            Item(Main  ): Feature, data= [ 0x83 ] 131
                            Constant Variable Absolute No_Wrap Linear
                            Preferred_State No_Null_Position Volatile Bitfield
            Item(Local ): Usage, data= [ 0x6f ] 111
                            Buck
            Item(Main  ): Input, data= [ 0x83 ] 131
                            Constant Variable Absolute No_Wrap Linear
                            Preferred_State No_Null_Position Volatile Bitfield
            Item(Main  ): End Collection, data=none
            Item(Main  ): End Collection, data=none
            Item(Local ): Usage, data= [ 0x1a ] 26
                            Input
            Item(Main  ): Collection, data= [ 0x83 ] 131
                            Vendor defined
            Item(Local ): Usage, data= [ 0x1b ] 27
                            Input ID
            Item(Global): Report ID, data= [ 0x1a ] 26
            Item(Global): Logical Maximum, data= [ 0xff 0x00 ] 255
            Item(Main  ): Feature, data= [ 0x03 ] 3
                            Constant Variable Absolute No_Wrap Linear
                            Preferred_State No_Null_Position Non_Volatile Bitfield
            Item(Local ): Usage, data= [ 0x1f ] 31
                            Flow ID
            Item(Main  ): Feature, data= [ 0x03 ] 3
                            Constant Variable Absolute No_Wrap Linear
                            Preferred_State No_Null_Position Non_Volatile Bitfield
            Item(Global): Usage Page, data= [ 0xff 0xff ] 65535
                            (null)
            Item(Local ): Usage, data= [ 0x46 ] 70
                            (null)
            Item(Global): Logical Maximum, data= [ 0x01 ] 1
            Item(Global): Report ID, data= [ 0x3b ] 59
            Item(Main  ): Feature, data= [ 0x82 ] 130
                            Data Variable Absolute No_Wrap Linear
                            Preferred_State No_Null_Position Volatile Bitfield
            Item(Local ): Usage, data= [ 0x47 ] 71
                            (null)
            Item(Global): Report ID, data= [ 0x1b ] 27
            Item(Main  ): Feature, data= [ 0x82 ] 130
                            Data Variable Absolute No_Wrap Linear
                            Preferred_State No_Null_Position Volatile Bitfield
            Item(Global): Usage Page, data= [ 0x84 ] 132
                            Power Device Page
            Item(Local ): Usage, data= [ 0x02 ] 2
                            Present Status
            Item(Main  ): Collection, data= [ 0x00 ] 0
                            Physical
            Item(Local ): Usage, data= [ 0x61 ] 97
                            Good
            Item(Global): Report ID, data= [ 0x04 ] 4
            Item(Main  ): Feature, data= [ 0x83 ] 131
                            Constant Variable Absolute No_Wrap Linear
                            Preferred_State No_Null_Position Volatile Bitfield
            Item(Local ): Usage, data= [ 0x61 ] 97
                            Good
            Item(Main  ): Input, data= [ 0x83 ] 131
                            Constant Variable Absolute No_Wrap Linear
                            Preferred_State No_Null_Position Volatile Bitfield
            Item(Local ): Usage, data= [ 0x6d ] 109
                            Used
            Item(Main  ): Feature, data= [ 0x83 ] 131
                            Constant Variable Absolute No_Wrap Linear
                            Preferred_State No_Null_Position Volatile Bitfield
            Item(Local ): Usage, data= [ 0x6d ] 109
                            Used
            Item(Main  ): Input, data= [ 0x83 ] 131
                            Constant Variable Absolute No_Wrap Linear
                            Preferred_State No_Null_Position Volatile Bitfield
            Item(Main  ): End Collection, data=none
            Item(Main  ): End Collection, data=none
            Item(Local ): Usage, data= [ 0x1c ] 28
                            Output
            Item(Main  ): Collection, data= [ 0x00 ] 0
                            Physical
            Item(Local ): Usage, data= [ 0x1d ] 29
                            Output ID
            Item(Global): Report ID, data= [ 0x1c ] 28
            Item(Global): Logical Maximum, data= [ 0xff 0x00 ] 255
            Item(Main  ): Feature, data= [ 0x83 ] 131
                            Constant Variable Absolute No_Wrap Linear
                            Preferred_State No_Null_Position Volatile Bitfield
            Item(Local ): Usage, data= [ 0x1f ] 31
                            Flow ID
            Item(Main  ): Feature, data= [ 0x83 ] 131
                            Constant Variable Absolute No_Wrap Linear
                            Preferred_State No_Null_Position Volatile Bitfield
            Item(Local ): Usage, data= [ 0x33 ] 51
                            Apparent Power
            Item(Global): Report Size, data= [ 0x10 ] 16
            Item(Global): Logical Maximum, data= [ 0xff 0xff 0x00 0x00 ] 65535
            Item(Global): Unit, data= [ 0x21 0xd1 ] 53537
            Item(Global): Unit Exponent, data= [ 0x07 ] 7
            Item(Main  ): Feature, data= [ 0x83 ] 131
                            Constant Variable Absolute No_Wrap Linear
                            Preferred_State No_Null_Position Volatile Bitfield
            Item(Local ): Usage, data= [ 0x31 ] 49
                            Current
            Item(Global): Unit, data= [ 0x01 0x00 0x10 0x00 ] 1048577
            Item(Global): Unit Exponent, data= [ 0x0e ] 14
            Item(Main  ): Feature, data= [ 0x83 ] 131
                            Constant Variable Absolute No_Wrap Linear
                            Preferred_State No_Null_Position Volatile Bitfield
            Item(Local ): Usage, data= [ 0x30 ] 48
                            Voltage
            Item(Global): Unit, data= [ 0x21 0xd1 0xf0 0x00 ] 15782177
            Item(Global): Unit Exponent, data= [ 0x07 ] 7
            Item(Main  ): Feature, data= [ 0x83 ] 131
                            Constant Variable Absolute No_Wrap Linear
                            Preferred_State No_Null_Position Volatile Bitfield
            Item(Local ): Usage, data= [ 0x32 ] 50
                            Frequency
            Item(Global): Report Size, data= [ 0x08 ] 8
            Item(Global): Logical Maximum, data= [ 0xff 0x00 ] 255
            Item(Global): Unit, data= [ 0x01 0xf0 ] 61441
            Item(Global): Unit Exponent, data= [ 0x00 ] 0
            Item(Main  ): Feature, data= [ 0x83 ] 131
                            Constant Variable Absolute No_Wrap Linear
                            Preferred_State No_Null_Position Volatile Bitfield
            Item(Global): Usage Page, data= [ 0xff 0xff ] 65535
                            (null)
            Item(Local ): Usage, data= [ 0x4e ] 78
                            (null)
            Item(Global): Report ID, data= [ 0x1d ] 29
            Item(Global): Logical Maximum, data= [ 0x01 ] 1
            Item(Global): Unit, data= [ 0x00 ] 0
            Item(Main  ): Feature, data= [ 0x82 ] 130
                            Data Variable Absolute No_Wrap Linear
                            Preferred_State No_Null_Position Volatile Bitfield
            Item(Local ): Usage, data= [ 0x4b ] 75
                            (null)
            Item(Global): Report ID, data= [ 0x1e ] 30
            Item(Main  ): Feature, data= [ 0x82 ] 130
                            Data Variable Absolute No_Wrap Linear
                            Preferred_State No_Null_Position Volatile Bitfield
            Item(Local ): Usage, data= [ 0x44 ] 68
                            (null)
            Item(Global): Report ID, data= [ 0x1f ] 31
            Item(Main  ): Feature, data= [ 0x82 ] 130
                            Data Variable Absolute No_Wrap Linear
                            Preferred_State No_Null_Position Volatile Bitfield
            Item(Local ): Usage, data= [ 0x53 ] 83
                            (null)
            Item(Global): Report ID, data= [ 0x20 ] 32
            Item(Global): Report Size, data= [ 0x10 ] 16
            Item(Global): Logical Maximum, data= [ 0xff 0xff 0x00 0x00 ] 65535
            Item(Global): Unit, data= [ 0x21 0xd1 0xf0 0x00 ] 15782177
            Item(Global): Unit Exponent, data= [ 0x07 ] 7
            Item(Main  ): Feature, data= [ 0x82 ] 130
                            Data Variable Absolute No_Wrap Linear
                            Preferred_State No_Null_Position Volatile Bitfield
            Item(Local ): Usage, data= [ 0x50 ] 80
                            (null)
            Item(Global): Report ID, data= [ 0x22 ] 34
            Item(Main  ): Feature, data= [ 0x82 ] 130
                            Data Variable Absolute No_Wrap Linear
                            Preferred_State No_Null_Position Volatile Bitfield
            Item(Global): Usage Page, data= [ 0x84 ] 132
                            Power Device Page
            Item(Local ): Usage, data= [ 0x54 ] 84
                            High Voltage Transfer
            Item(Global): Report ID, data= [ 0x21 ] 33
            Item(Main  ): Feature, data= [ 0x82 ] 130
                            Data Variable Absolute No_Wrap Linear
                            Preferred_State No_Null_Position Volatile Bitfield
            Item(Local ): Usage, data= [ 0x53 ] 83
                            Low Voltage Transfer
            Item(Global): Report ID, data= [ 0x23 ] 35
            Item(Main  ): Feature, data= [ 0x82 ] 130
                            Data Variable Absolute No_Wrap Linear
                            Preferred_State No_Null_Position Volatile Bitfield
            Item(Global): Usage Page, data= [ 0xff 0xff ] 65535
                            (null)
            Item(Local ): Usage, data= [ 0x4c ] 76
                            (null)
            Item(Global): Report ID, data= [ 0x24 ] 36
            Item(Global): Report Size, data= [ 0x08 ] 8
            Item(Global): Logical Maximum, data= [ 0xff 0x00 ] 255
            Item(Global): Unit, data= [ 0x00 ] 0
            Item(Global): Unit Exponent, data= [ 0x00 ] 0
            Item(Main  ): Feature, data= [ 0x82 ] 130
                            Data Variable Absolute No_Wrap Linear
                            Preferred_State No_Null_Position Volatile Bitfield
            Item(Global): Usage Page, data= [ 0x84 ] 132
                            Power Device Page
            Item(Local ): Usage, data= [ 0x02 ] 2
                            Present Status
            Item(Main  ): Collection, data= [ 0x00 ] 0
                            Physical
            Item(Local ): Usage, data= [ 0x65 ] 101
                            Overload
            Item(Global): Report ID, data= [ 0x05 ] 5
            Item(Global): Logical Maximum, data= [ 0x01 ] 1
            Item(Main  ): Feature, data= [ 0x83 ] 131
                            Constant Variable Absolute No_Wrap Linear
                            Preferred_State No_Null_Position Volatile Bitfield
            Item(Local ): Usage, data= [ 0x65 ] 101
                            Overload
            Item(Main  ): Input, data= [ 0x83 ] 131
                            Constant Variable Absolute No_Wrap Linear
                            Preferred_State No_Null_Position Volatile Bitfield
            Item(Global): Usage Page, data= [ 0xff 0xff ] 65535
                            (null)
            Item(Local ): Usage, data= [ 0x4a ] 74
                            (null)
            Item(Main  ): Feature, data= [ 0x83 ] 131
                            Constant Variable Absolute No_Wrap Linear
                            Preferred_State No_Null_Position Volatile Bitfield
            Item(Local ): Usage, data= [ 0x4a ] 74
                            (null)
            Item(Main  ): Input, data= [ 0x83 ] 131
                            Constant Variable Absolute No_Wrap Linear
                            Preferred_State No_Null_Position Volatile Bitfield
            Item(Main  ): End Collection, data=none
            Item(Main  ): End Collection, data=none
            Item(Main  ): End Collection, data=none
            Item(Global): Usage Page, data= [ 0x84 ] 132
                            Power Device Page
            Item(Local ): Usage, data= [ 0x18 ] 24
                            Outlet System
            Item(Main  ): Collection, data= [ 0x00 ] 0
                            Physical
            Item(Local ): Usage, data= [ 0x19 ] 25
                            Outlet System ID
            Item(Global): Report ID, data= [ 0x16 ] 22
            Item(Global): Logical Maximum, data= [ 0xff 0x00 ] 255
            Item(Main  ): Feature, data= [ 0x83 ] 131
                            Constant Variable Absolute No_Wrap Linear
                            Preferred_State No_Null_Position Volatile Bitfield
            Item(Local ): Usage, data= [ 0x20 ] 32
                            Outlet
            Item(Main  ): Collection, data= [ 0x81 ] 129
                            Vendor defined
            Item(Local ): Usage, data= [ 0x21 ] 33
                            Outlet ID
            Item(Main  ): Feature, data= [ 0x83 ] 131
                            Constant Variable Absolute No_Wrap Linear
                            Preferred_State No_Null_Position Volatile Bitfield
            Item(Local ): Usage, data= [ 0x1f ] 31
                            Flow ID
            Item(Main  ): Feature, data= [ 0x83 ] 131
                            Constant Variable Absolute No_Wrap Linear
                            Preferred_State No_Null_Position Volatile Bitfield
            Item(Local ): Usage, data= [ 0x02 ] 2
                            Present Status
            Item(Main  ): Collection, data= [ 0x00 ] 0
                            Physical
            Item(Local ): Usage, data= [ 0x6c ] 108
                            Switchable
            Item(Global): Report ID, data= [ 0x02 ] 2
            Item(Global): Logical Maximum, data= [ 0x01 ] 1
            Item(Main  ): Feature, data= [ 0x03 ] 3
                            Constant Variable Absolute No_Wrap Linear
                            Preferred_State No_Null_Position Non_Volatile Bitfield
            Item(Main  ): End Collection, data=none
            Item(Main  ): End Collection, data=none
            Item(Local ): Usage, data= [ 0x20 ] 32
                            Outlet
            Item(Main  ): Collection, data= [ 0x82 ] 130
                            Vendor defined
            Item(Local ): Usage, data= [ 0x21 ] 33
                            Outlet ID
            Item(Global): Report ID, data= [ 0x31 ] 49
            Item(Global): Logical Maximum, data= [ 0xff 0x00 ] 255
            Item(Main  ): Feature, data= [ 0x03 ] 3
                            Constant Variable Absolute No_Wrap Linear
                            Preferred_State No_Null_Position Non_Volatile Bitfield
            Item(Local ): Usage, data= [ 0x1f ] 31
                            Flow ID
            Item(Main  ): Feature, data= [ 0x03 ] 3
                            Constant Variable Absolute No_Wrap Linear
                            Preferred_State No_Null_Position Non_Volatile Bitfield
            Item(Local ): Usage, data= [ 0x57 ] 87
                            Delay Before Shutdown
            Item(Global): Report ID, data= [ 0x2f ] 47
            Item(Global): Report Size, data= [ 0x18 ] 24
            Item(Global): Logical Minimum, data= [ 0xff ] 255
            Item(Global): Logical Maximum, data= [ 0xff 0xff 0x00 0x00 ] 65535
            Item(Global): Unit, data= [ 0x01 0x10 ] 4097
            Item(Main  ): Feature, data= [ 0x82 ] 130
                            Data Variable Absolute No_Wrap Linear
                            Preferred_State No_Null_Position Volatile Bitfield
            Item(Local ): Usage, data= [ 0x56 ] 86
                            Delay Before Startup
            Item(Global): Report ID, data= [ 0x30 ] 48
            Item(Global): Unit Exponent, data= [ 0x00 ] 0
            Item(Main  ): Feature, data= [ 0x82 ] 130
                            Data Variable Absolute No_Wrap Linear
                            Preferred_State No_Null_Position Volatile Bitfield
            Item(Global): Usage Page, data= [ 0xff 0xff ] 65535
                            (null)
            Item(Local ): Usage, data= [ 0x5d ] 93
                            (null)
            Item(Global): Report ID, data= [ 0x33 ] 51
            Item(Global): Report Size, data= [ 0x10 ] 16
            Item(Global): Logical Minimum, data= [ 0x00 ] 0
            Item(Global): Logical Maximum, data= [ 0xff 0xff 0x00 0x00 ] 65535
            Item(Global): Unit Exponent, data= [ 0x00 ] 0
            Item(Main  ): Feature, data= [ 0x82 ] 130
                            Data Variable Absolute No_Wrap Linear
                            Preferred_State No_Null_Position Volatile Bitfield
            Item(Local ): Usage, data= [ 0x5e ] 94
                            (null)
            Item(Global): Report ID, data= [ 0x34 ] 52
            Item(Main  ): Feature, data= [ 0x82 ] 130
                            Data Variable Absolute No_Wrap Linear
                            Preferred_State No_Null_Position Volatile Bitfield
            Item(Global): Usage Page, data= [ 0x85 ] 133
                            Battery System Page
            Item(Local ): Usage, data= [ 0x29 ] 41
                            Remaining Capacity Limit
            Item(Global): Report ID, data= [ 0x32 ] 50
            Item(Global): Report Size, data= [ 0x08 ] 8
            Item(Global): Logical Maximum, data= [ 0xff 0x00 ] 255
            Item(Global): Unit, data= [ 0x00 ] 0
            Item(Main  ): Feature, data= [ 0x82 ] 130
                            Data Variable Absolute No_Wrap Linear
                            Preferred_State No_Null_Position Volatile Bitfield
            Item(Global): Usage Page, data= [ 0x84 ] 132
                            Power Device Page
            Item(Local ): Usage, data= [ 0x02 ] 2
                            Present Status
            Item(Main  ): Collection, data= [ 0x00 ] 0
                            Physical
            Item(Local ): Usage, data= [ 0x6c ] 108
                            Switchable
            Item(Global): Report ID, data= [ 0x07 ] 7
            Item(Global): Logical Maximum, data= [ 0x01 ] 1
            Item(Main  ): Feature, data= [ 0x83 ] 131
                            Constant Variable Absolute No_Wrap Linear
                            Preferred_State No_Null_Position Volatile Bitfield
            Item(Local ): Usage, data= [ 0x6c ] 108
                            Switchable
            Item(Main  ): Input, data= [ 0x83 ] 131
                            Constant Variable Absolute No_Wrap Linear
                            Preferred_State No_Null_Position Volatile Bitfield
            Item(Local ): Usage, data= [ 0x6b ] 107
                            Switch On/Off
            Item(Main  ): Feature, data= [ 0x83 ] 131
                            Constant Variable Absolute No_Wrap Linear
                            Preferred_State No_Null_Position Volatile Bitfield
            Item(Local ): Usage, data= [ 0x6b ] 107
                            Switch On/Off
            Item(Main  ): Input, data= [ 0x83 ] 131
                            Constant Variable Absolute No_Wrap Linear
                            Preferred_State No_Null_Position Volatile Bitfield
            Item(Main  ): End Collection, data=none
            Item(Main  ): End Collection, data=none
            Item(Local ): Usage, data= [ 0x20 ] 32
                            Outlet
            Item(Main  ): Collection, data= [ 0x83 ] 131
                            Vendor defined
            Item(Local ): Usage, data= [ 0x21 ] 33
                            Outlet ID
            Item(Global): Report ID, data= [ 0x31 ] 49
            Item(Global): Logical Maximum, data= [ 0xff 0x00 ] 255
            Item(Main  ): Feature, data= [ 0x03 ] 3
                            Constant Variable Absolute No_Wrap Linear
                            Preferred_State No_Null_Position Non_Volatile Bitfield
            Item(Local ): Usage, data= [ 0x1f ] 31
                            Flow ID
            Item(Main  ): Feature, data= [ 0x03 ] 3
                            Constant Variable Absolute No_Wrap Linear
                            Preferred_State No_Null_Position Non_Volatile Bitfield
            Item(Local ): Usage, data= [ 0x57 ] 87
                            Delay Before Shutdown
            Item(Global): Report ID, data= [ 0x35 ] 53
            Item(Global): Report Size, data= [ 0x18 ] 24
            Item(Global): Logical Minimum, data= [ 0xff ] 255
            Item(Global): Logical Maximum, data= [ 0xff 0xff 0x00 0x00 ] 65535
            Item(Global): Unit, data= [ 0x01 0x10 ] 4097
            Item(Main  ): Feature, data= [ 0x82 ] 130
                            Data Variable Absolute No_Wrap Linear
                            Preferred_State No_Null_Position Volatile Bitfield
            Item(Local ): Usage, data= [ 0x56 ] 86
                            Delay Before Startup
            Item(Global): Report ID, data= [ 0x36 ] 54
            Item(Global): Unit Exponent, data= [ 0x00 ] 0
            Item(Main  ): Feature, data= [ 0x82 ] 130
                            Data Variable Absolute No_Wrap Linear
                            Preferred_State No_Null_Position Volatile Bitfield
            Item(Global): Usage Page, data= [ 0xff 0xff ] 65535
                            (null)
            Item(Local ): Usage, data= [ 0x5d ] 93
                            (null)
            Item(Global): Report ID, data= [ 0x38 ] 56
            Item(Global): Report Size, data= [ 0x10 ] 16
            Item(Global): Logical Minimum, data= [ 0x00 ] 0
            Item(Global): Unit Exponent, data= [ 0x00 ] 0
            Item(Main  ): Feature, data= [ 0x82 ] 130
                            Data Variable Absolute No_Wrap Linear
                            Preferred_State No_Null_Position Volatile Bitfield
            Item(Local ): Usage, data= [ 0x5e ] 94
                            (null)
            Item(Global): Report ID, data= [ 0x39 ] 57
            Item(Main  ): Feature, data= [ 0x82 ] 130
                            Data Variable Absolute No_Wrap Linear
                            Preferred_State No_Null_Position Volatile Bitfield
            Item(Global): Usage Page, data= [ 0x85 ] 133
                            Battery System Page
            Item(Local ): Usage, data= [ 0x29 ] 41
                            Remaining Capacity Limit
            Item(Global): Report ID, data= [ 0x37 ] 55
            Item(Global): Report Size, data= [ 0x08 ] 8
            Item(Global): Logical Maximum, data= [ 0xff 0x00 ] 255
            Item(Global): Unit, data= [ 0x00 ] 0
            Item(Global): Unit Exponent, data= [ 0x00 ] 0
            Item(Main  ): Feature, data= [ 0x82 ] 130
                            Data Variable Absolute No_Wrap Linear
                            Preferred_State No_Null_Position Volatile Bitfield
            Item(Global): Usage Page, data= [ 0x84 ] 132
                            Power Device Page
            Item(Local ): Usage, data= [ 0x02 ] 2
                            Present Status
            Item(Main  ): Collection, data= [ 0x00 ] 0
                            Physical
            Item(Local ): Usage, data= [ 0x6c ] 108
                            Switchable
            Item(Global): Report ID, data= [ 0x08 ] 8
            Item(Global): Logical Maximum, data= [ 0x01 ] 1
            Item(Main  ): Feature, data= [ 0x83 ] 131
                            Constant Variable Absolute No_Wrap Linear
                            Preferred_State No_Null_Position Volatile Bitfield
            Item(Local ): Usage, data= [ 0x6c ] 108
                            Switchable
            Item(Main  ): Input, data= [ 0x83 ] 131
                            Constant Variable Absolute No_Wrap Linear
                            Preferred_State No_Null_Position Volatile Bitfield
            Item(Local ): Usage, data= [ 0x6b ] 107
                            Switch On/Off
            Item(Main  ): Feature, data= [ 0x83 ] 131
                            Constant Variable Absolute No_Wrap Linear
                            Preferred_State No_Null_Position Volatile Bitfield
            Item(Local ): Usage, data= [ 0x6b ] 107
                            Switch On/Off
            Item(Main  ): Input, data= [ 0x83 ] 131
                            Constant Variable Absolute No_Wrap Linear
                            Preferred_State No_Null_Position Volatile Bitfield
            Item(Main  ): End Collection, data=none
            Item(Main  ): End Collection, data=none
            Item(Main  ): End Collection, data=none
            Item(Main  ): End Collection, data=none
      Endpoint Descriptor:
        bLength                 7
        bDescriptorType         5
        bEndpointAddress     0x81  EP 1 IN
        bmAttributes            3
          Transfer Type            Interrupt
          Synch Type               None
          Usage Type               Data
        wMaxPacketSize     0x0008  1x 8 bytes
        bInterval              20
